{
  "$schema": "instruction-catalog-v4.schema.json",
  "schemaVersion": 4,
  "lastSemanticReview": "2026-09-01",
  "upstreamSnapshot": {
    "repository": "hashicorp/terraform-provider-azurerm",
    "baselineCommit": "e555ab3e9cc1656b6199c4cecc04e6da15eee23f",
    "currentRef": "main"
  },
  "ruleDefaults": {
    "requirementLevel": "mandatory",
    "enforcementMethod": "model-based",
    "documentationGap": false
  },
  "sources": [
    {
      "id": "contributing-readme",
      "title": "AzureRM Provider Contributor Guides",
      "rawUrl": "https://raw.githubusercontent.com/hashicorp/terraform-provider-azurerm/main/contributing/README.md",
      "referenceUrl": "https://github.com/hashicorp/terraform-provider-azurerm/blob/main/contributing/README.md",
      "baselineSha256": "5147b3b9918a82dd4cb0ddd9d01701675af649491208410d242a96ebe7423a7e"
    },
    {
      "id": "building-the-provider",
      "title": "Building the Provider",
      "rawUrl": "https://raw.githubusercontent.com/hashicorp/terraform-provider-azurerm/main/contributing/topics/building-the-provider.md",
      "referenceUrl": "https://github.com/hashicorp/terraform-provider-azurerm/blob/main/contributing/topics/building-the-provider.md",
      "baselineSha256": "57f7750ff5d93b3285a81895809e8bfae96968498c2b8c80c0d05009f9ec65dd"
    },
    {
      "id": "debugging-the-provider",
      "title": "Debugging the Provider",
      "rawUrl": "https://raw.githubusercontent.com/hashicorp/terraform-provider-azurerm/main/contributing/topics/debugging-the-provider.md",
      "referenceUrl": "https://github.com/hashicorp/terraform-provider-azurerm/blob/main/contributing/topics/debugging-the-provider.md",
      "baselineSha256": "defe5a8e1033e686e0adc1a927f7cc1a6931fc27a3407a1237385d87b4cf3533"
    },
    {
      "id": "frequently-asked-questions",
      "title": "Frequently Asked Questions",
      "rawUrl": "https://raw.githubusercontent.com/hashicorp/terraform-provider-azurerm/main/contributing/topics/frequently-asked-questions.md",
      "referenceUrl": "https://github.com/hashicorp/terraform-provider-azurerm/blob/main/contributing/topics/frequently-asked-questions.md",
      "baselineSha256": "872030e9203527835ca3f05e762265eaf11fde45d70750d5f32197e9fb7cad5c"
    },
    {
      "id": "high-level-overview",
      "title": "High Level Overview",
      "rawUrl": "https://raw.githubusercontent.com/hashicorp/terraform-provider-azurerm/main/contributing/topics/high-level-overview.md",
      "referenceUrl": "https://github.com/hashicorp/terraform-provider-azurerm/blob/main/contributing/topics/high-level-overview.md",
      "baselineSha256": "6aae0eb200c3822eaaa99216f75a1a0859def7dbe7778fcdbb7924a2a1534b97"
    },
    {
      "id": "reference-glossary",
      "title": "Glossary",
      "rawUrl": "https://raw.githubusercontent.com/hashicorp/terraform-provider-azurerm/main/contributing/topics/reference-glossary.md",
      "referenceUrl": "https://github.com/hashicorp/terraform-provider-azurerm/blob/main/contributing/topics/reference-glossary.md",
      "baselineSha256": "6aaef642055293e02a801f3dbb39c2847021b1bcf037cf9847475b2897b18077"
    },
    {
      "id": "running-the-tests",
      "title": "Running the Tests",
      "rawUrl": "https://raw.githubusercontent.com/hashicorp/terraform-provider-azurerm/main/contributing/topics/running-the-tests.md",
      "referenceUrl": "https://github.com/hashicorp/terraform-provider-azurerm/blob/main/contributing/topics/running-the-tests.md",
      "baselineSha256": "a99ecdb28904eb41dbfa4cfd847e64be3910d46bb2c5279f163b641c6a17cd6e"
    },
    {
      "id": "guide-opening-a-pr",
      "title": "Opening a PR",
      "rawUrl": "https://raw.githubusercontent.com/hashicorp/terraform-provider-azurerm/main/contributing/topics/guide-opening-a-pr.md",
      "referenceUrl": "https://github.com/hashicorp/terraform-provider-azurerm/blob/main/contributing/topics/guide-opening-a-pr.md",
      "baselineSha256": "e157cac522cd8d20cab9997ff8a5dbec1a49aec314dcdbab168794fb679ea6b9"
    },
    {
      "id": "best-practices",
      "title": "Best Practices",
      "rawUrl": "https://raw.githubusercontent.com/hashicorp/terraform-provider-azurerm/main/contributing/topics/best-practices.md",
      "referenceUrl": "https://github.com/hashicorp/terraform-provider-azurerm/blob/main/contributing/topics/best-practices.md",
      "baselineSha256": "0ef125f52ff74ab1c4531531269f9191ec671cacc388c631fa27198ddf424a8d"
    },
    {
      "id": "schema-design-considerations",
      "title": "Schema Design Considerations",
      "rawUrl": "https://raw.githubusercontent.com/hashicorp/terraform-provider-azurerm/main/contributing/topics/schema-design-considerations.md",
      "referenceUrl": "https://github.com/hashicorp/terraform-provider-azurerm/blob/main/contributing/topics/schema-design-considerations.md",
      "baselineSha256": "1b1b12cfb8962cde476e15a68e84f89595c9eee0a273ab51800aaafe7a4dfa30"
    },
    {
      "id": "reference-errors",
      "title": "Working with Errors",
      "rawUrl": "https://raw.githubusercontent.com/hashicorp/terraform-provider-azurerm/main/contributing/topics/reference-errors.md",
      "referenceUrl": "https://github.com/hashicorp/terraform-provider-azurerm/blob/main/contributing/topics/reference-errors.md",
      "baselineSha256": "380567682e3e3e197a0e509ec1b67c442bb4d01e65546c2af0740d3e4bf21c38"
    },
    {
      "id": "reference-acceptance-testing",
      "title": "Acceptance Testing",
      "rawUrl": "https://raw.githubusercontent.com/hashicorp/terraform-provider-azurerm/main/contributing/topics/reference-acceptance-testing.md",
      "referenceUrl": "https://github.com/hashicorp/terraform-provider-azurerm/blob/main/contributing/topics/reference-acceptance-testing.md",
      "baselineSha256": "a452e1f67d91fe14d0d29cfb9a6dbf994727943925e7304e3583f884daba8572"
    },
    {
      "id": "reference-documentation-standards",
      "title": "Provider Documentation Standards",
      "rawUrl": "https://raw.githubusercontent.com/hashicorp/terraform-provider-azurerm/main/contributing/topics/reference-documentation-standards.md",
      "referenceUrl": "https://github.com/hashicorp/terraform-provider-azurerm/blob/main/contributing/topics/reference-documentation-standards.md",
      "baselineSha256": "5a32d98fb9f70461e216cd89a1a8347aa8684c508897a0402df3e2c711391843"
    },
    {
      "id": "guide-new-resource",
      "title": "Guide: New Resource",
      "rawUrl": "https://raw.githubusercontent.com/hashicorp/terraform-provider-azurerm/main/contributing/topics/guide-new-resource.md",
      "referenceUrl": "https://github.com/hashicorp/terraform-provider-azurerm/blob/main/contributing/topics/guide-new-resource.md",
      "baselineSha256": "3ed25d9bcfe71aea8c836c97c6434cc64909099f9210b7723401ccd206cfd2c8"
    },
    {
      "id": "guide-new-data-source",
      "title": "Guide: New Data Source",
      "rawUrl": "https://raw.githubusercontent.com/hashicorp/terraform-provider-azurerm/main/contributing/topics/guide-new-data-source.md",
      "referenceUrl": "https://github.com/hashicorp/terraform-provider-azurerm/blob/main/contributing/topics/guide-new-data-source.md",
      "baselineSha256": "654620707ffc7cd05a31483e5a4cecec88b9272e599f4ee4436da8399f2eb6af"
    },
    {
      "id": "maintainer-merging",
      "title": "Maintainer Specific: Merging Pull Requests",
      "rawUrl": "https://raw.githubusercontent.com/hashicorp/terraform-provider-azurerm/main/contributing/topics/maintainer-merging.md",
      "referenceUrl": "https://github.com/hashicorp/terraform-provider-azurerm/blob/main/contributing/topics/maintainer-merging.md",
      "baselineSha256": "452abd4676c0f03c2f58aca2e34e79f59c43ac8df7775de925b776c3be6b77dc"
    },
    {
      "id": "guide-api-version",
      "title": "Guide: ARM API Versions",
      "rawUrl": "https://raw.githubusercontent.com/hashicorp/terraform-provider-azurerm/main/contributing/topics/guide-api-version.md",
      "referenceUrl": "https://github.com/hashicorp/terraform-provider-azurerm/blob/main/contributing/topics/guide-api-version.md",
      "baselineSha256": "7cf7f0b75da21f9f867b13bec8e32c649e076385fcc56e63c98a3ba77989a4b3"
    },
    {
      "id": "guide-breaking-changes",
      "title": "Guide: Breaking Changes and Deprecations",
      "rawUrl": "https://raw.githubusercontent.com/hashicorp/terraform-provider-azurerm/main/contributing/topics/guide-breaking-changes.md",
      "referenceUrl": "https://github.com/hashicorp/terraform-provider-azurerm/blob/main/contributing/topics/guide-breaking-changes.md",
      "baselineSha256": "4a171e794e0b9c0a4614142a74d0ffe3e4dccd20185ad2704522a1007030ee08"
    },
    {
      "id": "guide-list-resource",
      "title": "Guide: List Resource",
      "rawUrl": "https://raw.githubusercontent.com/hashicorp/terraform-provider-azurerm/main/contributing/topics/guide-list-resource.md",
      "referenceUrl": "https://github.com/hashicorp/terraform-provider-azurerm/blob/main/contributing/topics/guide-list-resource.md",
      "baselineSha256": "6642bc6593814ff787ff7377ad14b11bfbacdc0502d2d5e823398607d84c3dff"
    },
    {
      "id": "guide-new-feature",
      "title": "Guide: Adding a new Feature to the Features Block",
      "rawUrl": "https://raw.githubusercontent.com/hashicorp/terraform-provider-azurerm/main/contributing/topics/guide-new-feature.md",
      "referenceUrl": "https://github.com/hashicorp/terraform-provider-azurerm/blob/main/contributing/topics/guide-new-feature.md",
      "baselineSha256": "8f1ea7cc20780fd4c833751c5658400c76c65777b6d997edc3cdb2fa0c5d5fde"
    },
    {
      "id": "guide-new-fields-to-data-source",
      "title": "Guide: Extending a Data Source",
      "rawUrl": "https://raw.githubusercontent.com/hashicorp/terraform-provider-azurerm/main/contributing/topics/guide-new-fields-to-data-source.md",
      "referenceUrl": "https://github.com/hashicorp/terraform-provider-azurerm/blob/main/contributing/topics/guide-new-fields-to-data-source.md",